SurgeryType,Category,Question,Alternate_Questions,Answer
spinal deformity,Life After Surgery,Can I ever play sports again?,- Will I be able to return to my sport? <br>- What activities are safe after a long fusion? <br>- Are there any permanent restrictions? <br>- When can I resume athletic activities? <br>- Is it safe to play contact sports?,"After your fusion is completely solid, which can take up to a year, you can return to many activities. We generally recommend avoiding high-impact or collision sports like football or rugby permanently. However, activities like swimming, biking, and light jogging are usually fine. We will discuss your specific goals."
spinal deformity,Life After Surgery,Will I feel stiff for the rest of my life?,- How much flexibility will I lose permanently? <br>- Will I be able to bend and move normally eventually? <br>- Does a long fusion make your back feel stiff? <br>- What will my motion be like in the long run? <br>- Is the loss of motion significant?,"You will have a permanent loss of motion in the fused segments of your spine. However, your brain and body are remarkable at adapting. Most of the bending we do comes from our hips, and you will learn to use your unfused segments and hips more efficiently. Most patients adapt very well and do not feel overly restricted in their daily activities."
spinal deformity,Follow-Up,How do you know if the fusion is healing properly?,- How do you check the fusion? <br>- Will I need a CT scan after surgery? <br>- What do you look for on the x-rays? <br>- How can you tell if the bone is solid? <br>- What is the follow-up imaging schedule?,"We will monitor your fusion with a series of x-rays at your follow-up appointments. On these images, we can see the new bone forming and solidifying over time. If there is ever a question about the healing, we may order a CT scan, which gives us a much more detailed, 3D view of the fusion."
spinal deformity,Scope of Surgery,Will my back look normal after the surgery?,- Will my hump be gone? <br>- Will my shoulders be even? <br>- Can you make my back straight? <br>- How much correction can you get? <br>- Will I look different in clothes?,"The goal of the surgery is to significantly improve the curve and your overall alignment. While a perfect correction is not always possible, we aim to make your back appear much straighter and more balanced. Most patients are very pleased with the improvement in their posture and how their clothes fit afterward."
spinal deformity,Scope of Surgery,Why do you have to fuse so many bones?,- Why is my fusion so long? <br>- Can't you just fix the worst part of the curve? <br>- Why does the fusion have to go all the way up/down my back? <br>- How do you decide how many levels to fuse? <br>- Is it necessary to fuse such a large part of my spine?,"To properly balance your spine, we need to fuse the entire length of the curve. If we only fused a small part of it, the un-fused parts of the curve above and below could continue to progress, leading to problems in the future. Fusing the entire curve gives you the most stable, lasting result."
spinal deformity,Risks & Complications,What is the biggest risk I should worry about?,- What is the most serious thing that can go wrong? <br>- What is the worst-case scenario? <br>- Which complication is the most dangerous? <br>- What is the most significant risk of this surgery? <br>- What keeps you up at night as the surgeon?,"While all risks are taken seriously, the most significant potential complication is a neurologic deficit, which means injury to the spinal cord or nerves. I want to reassure you that this is extremely rare. We use advanced spinal cord monitoring throughout the entire surgery to protect you, and your safety is our absolute first priority."
spinal deformity,Risks & Complications,What happens if I get an infection?,- How do you treat an infection after surgery? <br>- Is an infection dangerous? <br>- What are the signs of an infection? <br>- How common are infections with this surgery? <br>- What if my wound gets infected?,"A deep wound infection is a serious complication. If it occurs, it often requires another surgery to wash out the wound, as well as a long course of IV antibiotics. We take extensive precautions to prevent this, including giving you antibiotics before, during, and after your surgery."
spinal deformity,Preparation,What can I do to be in the best shape for surgery?,"- How should I prepare my body for this operation? <br>- Is there any exercise I should be doing? <br>- How can I help make my recovery easier? <br>- What's the best way to get ready for surgery? <br>- What is ""pre-hab""?","The stronger and more fit you are before surgery, the better your recovery will be. The best things you can do are walking and deep breathing exercises. If you can, working with a physical therapist beforehand to optimize your condition can be very beneficial. And most importantly, you must not smoke."
spinal deformity,Preparation,Why do I need to see my regular doctor before surgery?,"- What is a ""medical clearance""? <br>- Why do I need to get cleared for surgery? <br>- What tests will my family doctor do? <br>- What if my doctor says I'm not healthy enough? <br>- Is it okay to have surgery with my other health problems?","This is a long and demanding surgery, so we need to make sure your body is ready for it. Your medical doctor will perform a thorough evaluation, including tests like an EKG and blood work, to ensure your heart, lungs, and overall health are optimized for a safe procedure and recovery."
spinal deformity,Preparation,How should I prepare my home for when I get back?,- What do I need to get for my house? <br>- How can I make my home safe for recovery? <br>- Do I need any special equipment? <br>- What should I do to get my house ready? <br>- Are there any home modifications I need?,"It's a great idea to prepare your home. Place frequently used items where you can reach them without bending. Remove throw rugs or cords you could trip over. You will need a chair with armrests, and you may want to install a hand-held shower head and a raised toilet seat."
spinal deformity,Hospital Stay,Will I wake up with a breathing tube in?,- Is it possible I'll still be on the ventilator after surgery? <br>- Why would I need to stay on a breathing machine? <br>- How long would the breathing tube stay in? <br>- Is it scary to wake up on a ventilator? <br>- What does it mean to be intubated?,"In some cases, after a very long surgery, the anesthesiologist may decide it's safest to leave the breathing tube in place overnight while you are in the ICU. This allows your body to rest and recover while the machine does the work of breathing for you. It is a standard safety measure and the tube is removed the next morning."
spinal deformity,Hospital Stay,"What is the ""log rolling"" I've heard about?",- How will the nurses move me in bed? <br>- Why do I have to turn like a log? <br>- Can I turn over by myself? <br>- What is the log roll technique? <br>- How do I move in bed without twisting?,"Log rolling is how we will turn you in bed to protect your fusion. The nurses will use a sheet to help turn your shoulders and hips at the same time, as a single unit, like a log. This prevents any twisting motion on your spine while it's healing."
spinal deformity,Hospital Stay,What is that plastic thing I have to breathe into?,- What is an incentive spirometer? <br>- Why do I have to do breathing exercises? <br>- How does that breathing machine work? <br>- What's the purpose of the breathing toy? <br>- Do I have to use the spirometer?,"That is an incentive spirometer, and it's one of the most important parts of your recovery in the hospital. Using it often helps you take deep breaths, which keeps your lungs open and clear after anesthesia. This is the best way to prevent complications like pneumonia."
spinal deformity,Hospital Stay,Will I be really swollen after the surgery?,- Is it normal to have a puffy face? <br>- Why do I look so swollen? <br>- How long will the swelling last? <br>- Is it from the IV fluids? <br>- Why is my whole body swollen?,"Yes, it is very common and normal to have significant swelling, especially in your face and body. This is caused by the large amount of IV fluids you receive during a long surgery and from being positioned on your stomach. The swelling will go away over the first few days."
spinal deformity,Recovery & Rehab,How do I clean my back brace?,- Can I wash the brace? <br>- What are the instructions for cleaning the brace? <br>- How do I keep my brace from getting smelly? <br>- Can I put the brace in the washing machine? <br>- What's the best way to care for my brace?,You can wipe the hard plastic parts of the brace with a damp cloth and mild soap. The soft liners can usually be hand-washed with gentle soap and water and should be left to air dry completely. It's a good idea to wear a thin t-shirt under your brace to keep it cleaner.
spinal deformity,Recovery & Rehab,"What does ""pain is a warning"" mean?",- How do I know if I'm doing too much? <br>- What if an activity hurts? <br>- Should I push through the pain? <br>- How do I listen to my body? <br>- What is a setback?,"It means you need to listen to your body. If you do an activity and have significantly increased pain for more than a couple of hours afterward, it's a sign that you've overdone it. Pain is your body's way of telling you to slow down and rest. Don't just take a pain pill and keep going."
spinal deformity,Recovery & Rehab,Will I need help taking a shower?,- Can I shower by myself? <br>- Will I need a shower chair? <br>- How do I wash my back? <br>- Is it safe to shower alone? <br>- What kind of help will I need in the bathroom?,"You will likely need some help with showering at first. You may feel weak or unsteady, so having someone nearby is important for safety. A shower chair and a long-handled sponge can be very helpful for washing your back and legs without bending or twisting."
spinal deformity,Recovery & Rehab,What is the most important exercise for me to do?,"- What is the best activity for my recovery? <br>- What kind of exercise should I be doing at home? <br>- Besides physical therapy, what should I do? <br>- Is there one exercise that is most important? <br>- What is the key to a good recovery?","Without a doubt, walking is the single most important exercise you can do. It helps your fusion heal, strengthens your muscles, helps your heart and lungs, and prevents blood clots. You should plan to walk several times a day, gradually increasing your distance as you feel stronger."
spinal deformity,Recovery & Rehab,How long will I need to take the strong pain medicine?,- When can I stop taking narcotics? <br>- How long will I be on the prescription pain pills? <br>- Will I be on pain medicine for months? <br>- When can I switch to Tylenol? <br>- How do I wean off the pain medication?,"You should expect to be on narcotic pain medication for several weeks after this surgery. The pain is significant, and it's important to stay ahead of it. We will work with you to create a plan to gradually decrease the narcotics as your pain improves and transition to over-the-counter options."
spinal deformity,Life After Surgery,Will my back feel weird with all that metal in it?,- Will I be able to feel the rods and screws? <br>- Does the hardware feel cold in the winter? <br>- Will my back feel heavy? <br>- Can you feel the implants under your skin? <br>- Does the metal cause any strange sensations?,"The rods and screws are placed deep under your strong back muscles, so you will not be able to feel them from the outside. The hardware is made of titanium and won't feel cold or heavy. Some patients report feeling more achy with weather changes, but most don't notice the implants at all."
spinal deformity,Life After Surgery,Will I be able to get an epidural for childbirth?,- Can I have an epidural if I have a fusion? <br>- Will the hardware get in the way of an epidural? <br>- Is it safe to get an epidural with rods in my back? <br>- Does the fusion affect pain control during labor? <br>- Should I tell the anesthesiologist about my surgery?,"Yes, in most cases, you can still have an epidural. It is very important to tell your obstetrician and the anesthesiologist about your surgery. They may need to use an ultrasound to guide the needle, but it is usually possible and safe to perform."
spinal deformity,Life After Surgery,Do I need to tell my dentist I have hardware in my back?,- Do I need to take antibiotics before dental work? <br>- Are there any special dental precautions? <br>- Does my dentist need to know about my surgery? <br>- Can I have my teeth cleaned after the fusion is healed? <br>- Are there any rules about going to the dentist?,"Yes, you should always inform your dentist about your spinal implants. Current guidelines do not typically require you to take antibiotics before a routine dental cleaning, but it is always best to make sure your dentist is aware of your surgical history."
spinal deformity,Life After Surgery,Will I be able to carry a backpack?,- Can I wear a backpack for school? <br>- Is it safe to carry a backpack after a fusion? <br>- How much weight can I carry in a backpack? <br>- Are there any special backpacks I should use? <br>- When can I start using a backpack again?,"Once your fusion is solid, usually after about a year, you can use a backpack. It is very important to use a good quality backpack with two padded shoulder straps and to wear it correctly over both shoulders. You should keep the weight in the backpack to a reasonable level, generally no more than 10-15% of your body weight."
spinal deformity,Follow-Up,What if my curve starts to get worse again?,"- Can the scoliosis come back after surgery? <br>- What is ""adding on""? <br>- Could I need another surgery in the future? <br>- What happens if the fusion stops at the wrong place? <br>- Is it possible for the curve to progress?","It is rare, but sometimes the spine can develop a new curve above or below the fused area. We call this ""adding on."" This is one of the reasons long-term follow-up is so important, so we can monitor your spine and catch any potential issues early."
spinal deformity,Follow-Up,How do you know if the screws are in the right place?,- Is it possible to put a screw in the wrong spot? <br>- How do you make sure the screws are safe? <br>- What protects my nerves from the screws? <br>- How accurate is the screw placement? <br>- What technology do you use to place the screws?,"We use advanced techniques like intra-operative CT scanning and computer navigation to place the screws with a very high degree of accuracy. This technology acts like a GPS for your spine, showing me the exact trajectory of the screw in real-time to ensure it is placed safely in the bone and away from your nerves."
spinal deformity,Follow-Up,"What is a ""bump in the road"" during recovery?",- What do you mean by a minor complication? <br>- Can you give me an example of a bump in the road? <br>- Are small problems common? <br>- How do you handle minor setbacks? <br>- What if I have a small issue during my recovery?,"A ""bump in the road"" is a minor, treatable problem that doesn't affect your final outcome. Examples might include a superficial wound issue that just needs dressing changes, temporary nerve irritation that gets better on its own, or a bladder infection that is easily treated with antibiotics."
spinal deformity,Follow-Up,What if I feel a pop or a crack in my back?,- Is it normal to feel things moving in my back? <br>- What should I do if I feel a pop? <br>- Can the hardware make noise? <br>- Is it bad if I feel a crack when I move? <br>- Should I be worried about popping sounds?,"It is common to feel occasional pops or clicks as you heal and start to move more. This is usually just scar tissue or the normal settling of your muscles and joints. However, if you feel a sudden, loud pop that is associated with a sharp increase in pain, you should call our office right away."
spinal deformity,Follow-Up,What is the most important thing I can do for a good result?,- What is the key to a successful surgery? <br>- What is my role in the recovery? <br>- How can I make sure I have the best outcome? <br>- What is the one thing I must do? <br>- What is the secret to a good recovery?,"The single most important thing you can do is to be an active and compliant partner in your own recovery. This means you absolutely must not smoke, you must follow the ""no bending, lifting, or twisting"" rules, and you must commit to your walking program. Your dedication is just as important as the surgery itself."
lumbar fusion,About the Procedure,What is the success rate for this surgery?,- How likely is it that this surgery will work for me? <br>- What are the chances this will fix my pain? <br>- How many of these surgeries are successful?,"The goal of a fusion is to stabilize the spine and reduce pain, and it has a very high success rate in achieving that. Success also depends on you. By following all of our post-operative instructions, especially the activity restrictions and not smoking, you give yourself the best possible chance for a great outcome."
lumbar fusion,About the Procedure,How is this different from a microdiscectomy?,"- I had a friend who had a microdiscectomy, is this the same? <br>- Why do I need a fusion instead of just removing the disc? <br>- Is a fusion a bigger surgery than a discectomy?","A microdiscectomy is a smaller surgery where we only remove the piece of disc that is pinching a nerve. A fusion is a more extensive procedure where we remove the entire disc and stabilize the bones to stop painful motion. We recommend a fusion when the problem is instability or significant disc collapse, not just a simple disc herniation."
lumbar fusion,About the Procedure,Will I be taller after the surgery?,- Does putting a cage in make you taller? <br>- Will my height change? <br>- How much height will I gain?,"When we remove the worn-out disc and replace it with a spacer or cage, we are restoring the disc to its normal, healthy height. Because of this, many patients do gain a small amount of height, perhaps a quarter to a half-inch, but it is not a primary goal of the surgery."
lumbar fusion,About the Procedure,Will I be able to feel the rods and screws?,- Can you feel the hardware under your skin? <br>- Is the metal noticeable from the outside? <br>- Will the implants bother me?,"No, the instrumentation is placed deep beneath the strong muscles of your back. You will not be able to feel the hardware, and it will not be visible from the outside."
lumbar fusion,About the Procedure,Will the hardware set off airport metal detectors?,- Do I need a doctor's note to fly? <br>- Will I have problems with TSA or security? <br>- Is the hardware magnetic?,The implants are made of medical-grade titanium alloy and are not magnetic. They typically do not set off modern airport metal detectors. It is not necessary to carry a special card or note with you when you travel.
lumbar fusion,About the Procedure,What happens if I don't have the surgery and just wait?,- What are the risks of not doing the surgery? <br>- Can my condition get worse if I wait? <br>- Is it dangerous to postpone the operation?,"If you have instability or nerve compression, waiting could allow the condition to worsen. This might lead to increased pain, progressive nerve damage, or more weakness in your legs. If non-surgical treatments have failed, surgery is the most reliable way to prevent further progression."
lumbar fusion,The Surgery,Why is a vascular surgeon involved in some cases?,- Will another surgeon be in the room? <br>- Who is the other doctor assisting you? <br>- What does the vascular surgeon do?,"For an anterior approach, where we enter from the front, we work with a vascular surgeon. They are experts at safely moving the large blood vessels in the abdomen aside so that I have a clear and direct path to the front of your spine. It's a team approach that makes the surgery safer."
lumbar fusion,The Surgery,Will I have more than one incision?,- How many cuts will I have? <br>- Why are there incisions on my back and side/front? <br>- Where will the scars be?,"The number and location of incisions depend on the specific approach we use. For some minimally invasive procedures, we may use two small incisions on your back. For an anterior or lateral approach, you will have an incision on your abdomen or side, and you may also have small incisions on your back if we need to place screws."
lumbar fusion,The Surgery,What is computer navigation?,"- How do you use a CT scan during surgery? <br>- What is the ""virtual reality"" technology you use? <br>- How do you make sure the screws are in the right place?","For some procedures, we use a special mobile CT scanner in the operating room. This gives us a real-time, 3D view of your spine. Using this image, computer navigation works like a GPS for your anatomy, allowing me to place the screws with exceptional accuracy and safety."
lumbar fusion,The Surgery,"How do you decide which approach (front, back, side) to use?",- Why did you choose this type of fusion for me? <br>- What determines the surgical approach? <br>- Is one approach better than another?,The decision is based entirely on your specific anatomy and the problem we need to fix. Each approach has unique advantages for accessing certain parts of the spine or placing larger implants. I have chosen the approach that will provide you with the safest and most effective result.
lumbar fusion,Risks & Complications,What is an ileus?,"- Why can't I eat right after surgery? <br>- What does ""temporary slowing of bowel function"" mean? <br>- Is it normal for my stomach not to work after surgery?","An ileus is a temporary and common condition where your bowels slow down after surgery, especially with an anterior (from the front) approach. It's a reaction to the anesthesia and the procedure. This is why we start you with ice chips and slowly advance your diet as your bowel function returns to normal."
lumbar fusion,Risks & Complications,What is the risk of a blood clot?,- How do you prevent blood clots in the legs? <br>- Am I at risk for a DVT or pulmonary embolism? <br>- What are the signs of a blood clot?,"A blood clot in the leg (DVT) is a risk with any major surgery. To prevent this, we will have you wear special compression stockings or devices on your legs in the hospital. The most important prevention is getting you up and walking as soon as possible after surgery to keep your blood circulating."
lumbar fusion,Risks & Complications,What happens if the cage or an implant moves?,- Can the hardware slip out of place? <br>- Is it possible for a screw to come loose? <br>- How stable are the implants?,"The implants we use are designed to lock securely into the bone. The risk of an implant moving or a screw coming loose is very low, especially when you follow the ""no bending, lifting, or twisting"" rule after surgery. We will check the position of all the hardware with x-rays at your follow-up visits."
lumbar fusion,Risks & Complications,What is the risk of sexual dysfunction?,- Can this surgery affect my sex life? <br>- Is it possible to have sexual problems after the operation? <br>- Why is sexual dysfunction listed as a risk?,"For the anterior (from the front) approach, there is a very small network of nerves near the spine that can affect ejaculation in men. Injury to these nerves is very rare, but we are obligated to inform you of the possibility. This is not a risk with posterior (from the back) or lateral (from the side) approaches."
lumbar fusion,Preparation,Why do I need to get my teeth cleaned before surgery?,- What does dental work have to do with back surgery? <br>- Can I go to the dentist after my surgery? <br>- Why is dental clearance required?,"Bacteria from your mouth can get into your bloodstream during a dental cleaning. We want to avoid any potential source of infection around your new implants, so we require you to have any dental work done before your fusion. You should not have any dental cleanings for six months after your surgery."
lumbar fusion,Preparation,What should I pack for the hospital?,- What do I need to bring with me? <br>- Is there a packing list for the hospital? <br>- What personal items should I have?,"You should bring personal toiletries like a toothbrush, toothpaste, and a comb. Pack loose-fitting, comfortable clothing with an elastic waistband for the trip home. Rubber-soled slippers or shoes are also a good idea. Please do not bring valuables or your home medications."
lumbar fusion,Preparation,How should I set up my house for recovery?,- What can I do to make my home safe for my return? <br>- Do I need any special equipment at home? <br>- How can I prepare my house before surgery?,It's a great idea to prepare your home. Place frequently used items on countertops so you don't have to bend down or reach up. Remove any loose rugs or cords that you could trip over. You may want to arrange for a raised toilet seat and have a stable chair to sit in.
lumbar fusion,After Surgery (Hospital Stay),Why am I so swollen after surgery?,- Is it normal to have swelling in my face and body? <br>- Why do I look so puffy? <br>- How long will the swelling last?,It is very common to have swelling after a long surgery. This is due to the large amount of IV fluids you receive to keep you hydrated and the fact that you are positioned on your stomach for several hours. The swelling is temporary and will resolve over the next few days.
