SurgeryType,Category,Question,Alternate_Questions,Answer
microdiscectomy,Post-Op Activity,How can I use the toilet without bending or twisting?,Is it hard to go to the bathroom after surgery?; How do I wipe myself?; What if my toilet is too low?,"Using the toilet is a normal activity, but you must be mindful of your BLT restrictions. To avoid excessive bending, consider using a raised toilet seat or a safety frame with arms that you can push up on. For personal hygiene, it is critical to avoid twisting your back. We highly recommend using a long-handled grabber or a specific personal hygiene wand to help you clean yourself safely without compromising your recovery."
microdiscectomy,Post-Op Activity,What is the safest way to get out of bed or a chair?,,"To get out of bed, use the ""log roll"" technique: bend your knees, roll onto your side as one single unit (like a log), and then use your arms to push yourself up to a seated position as you swing your legs off the bed. To get out of a chair, scoot to the very edge of the seat, keep your back straight, and use the power of your legs and arms to push straight up. Remember your BLT restrictions: No Bending or Twisting. Using a walker for extra support and stability is a great idea in the first few days."
microdiscectomy,Post-Op Activity,What is the typical timeline for returning to my job?,How much time should I take off work?; When can I go back to my office?,"Your return-to-work date is based on your job's physical demands. For office-based or sedentary work, 2 to 4 weeks is typical. For jobs requiring physical labor, you should plan for a longer recovery of 6 to 8 weeks, possibly more, to ensure your back has healed sufficiently."
microdiscectomy,Incision Care,What are the instructions for showering with the incision?,How do I keep my incision clean?; Is it okay if soap and water run over the wound?,"You can let water from the shower run over your incision starting 48 hours after your procedure. It's important not to scrub the area directly. When you're done, gently pat the site dry with a fresh towel."
microdiscectomy,Incision Care,Is it safe to take a bath or get in a pool?,When can I submerge my incision in water?; Can I use a jacuzzi?,"You must keep the incision out of standing water for 4 weeks. This means no baths, swimming pools, hot tubs, or lakes until the wound is fully healed and you've been cleared by the surgeon at your follow-up appointment."
microdiscectomy,Incision Care,How should I manage the dressing on my wound?,What do I do with the surgical tape?; Should I peel off the glue?,"Your incision is sealed with either steri-strips (special tape) or a surgical glue called Dermabond. You don't need to do anything with it. Leave it in place, and it will start to come off on its own in about 10 to 14 days."
microdiscectomy,Pain & Meds,What should I expect in terms of pain after the procedure?,Is it normal for the leg pain to come and go?; Will my back hurt?,You should expect to feel some soreness at the incision site itself. It's also common for the nerve-related leg pain (sciatica) to fluctuate during the healing process as the nerve recovers. This is a normal part of recovery.
microdiscectomy,Pain & Meds,What's the best strategy for taking my pain pills?,How do I use my narcotics effectively?; How do I wean off the pain medicine?,"For the first few days, it's best to take your pain medication on a regular schedule to prevent the pain from becoming severe. As you start to feel better, you can stretch out the time between doses and begin substituting with Tylenol."
microdiscectomy,Pain & Meds,What can I do to relieve constipation from the medication?,Is it normal to get backed up?; How do I treat constipation?,"It's very common to experience constipation from anesthesia and pain medicine. We suggest you begin taking an over-the-counter stool softener, like Colace, as soon as you start the narcotics. Staying hydrated and walking frequently are also very helpful."
microdiscectomy,Physical Therapy,Is a course of physical therapy required after this surgery?,Will I get a referral for PT?; What's the therapy plan?,"Formal physical therapy is not always necessary. For the initial 6 weeks, walking is the only therapy we recommend. At your 6-week check-up, we will assess your progress and decide if a PT referral would be beneficial for you."
microdiscectomy,Follow-Up,When will my first post-operative check-up be?,How soon do I come back to the clinic?; What is the purpose of the first visit?,Your first appointment back in our office will be scheduled for approximately two weeks after your surgery. The main purpose of this visit is to inspect your incision and ensure your initial recovery is on track. Your next key appointment is usually 6 weeks post-op.
microdiscectomy,Warning Signs,How can I tell if my incision is getting infected?,What does an infected wound look like?; Is some redness okay?,"Please contact us if you see signs of infection, such as spreading redness, increased swelling, warmth to the touch, or any thick, cloudy, or colored discharge. A small amount of pinkish or clear fluid in the first day or so is not unusual."
microdiscectomy,Warning Signs,Which symptoms are considered urgent and require a phone call?,What are the emergency signs?; When should I call the on-call doctor?,"Please call us immediately for any of these ""red flag"" symptoms: a temperature above 101.5°F (38.6°C), any new or progressing weakness in your leg or foot, or any change in your ability to control your bladder or bowels."
microdiscectomy,Warning Signs,What does it mean if I get a bad headache that's worse when I'm upright?,Is a positional headache a problem?; Why does my head pound when I stand up?,"If you experience a severe headache that feels significantly worse when you sit or stand and improves when you lie flat, you need to call our office. This specific type of headache can be a sign of a spinal fluid leak, which we need to know about."
microdiscectomy,Warning Signs,What should I do about new pain or swelling in my lower leg?,Is calf pain a warning sign?; What are the symptoms of a DVT?,"New pain, tenderness, swelling, or redness that appears in your calf muscle could be a sign of a deep vein thrombosis (DVT), or blood clot. This is a serious condition, so please contact our office right away if you notice these symptoms."
microdiscectomy,Foundational,What is a lumbar microdiscectomy?,Why am I having this surgery?; What does the operation do?,"A lumbar microdiscectomy is a minimally invasive surgery performed to remove the portion of a herniated disc in your lower back that is pressing on a nerve. The goal is to relieve the leg pain, numbness, or weakness caused by the nerve compression."
microdiscectomy,Pre-Op Meds,What pain medications should I stop before surgery?,Can I take Advil?; Is Ibuprofen okay?; What about Aleve?; Which pain meds are not allowed?,"You must stop all NSAIDs (Non-Steroidal Anti-Inflammatory Drugs) at least 7 days before your surgery. This includes Ibuprofen (Advil, Motrin), Naproxen (Aleve), Meloxicam, and Diclofenac. Tylenol (Acetaminophen) is generally safe to continue."
microdiscectomy,Pre-Op Meds,What about my blood thinners like Aspirin or Plavix?,Do I need to stop my heart medication?; What about Xarelto or Eliquis?,"It is essential that you discuss stopping any blood thinner (Aspirin, Plavix, Xarelto, Eliquis, Coumadin) with the prescribing doctor (e.g., your cardiologist). We will provide specific instructions based on their recommendations, but our standard protocol requires stopping them 5-7 days before surgery."
microdiscectomy,Pre-Op Meds,Should I continue taking nerve medications like Neurontin or Lyrica?,What about gabapentin?; Do I stop pregabalin?,"These are nerve medications and help to calm down irritated or excited nerves. If you are currently on one of these medications, you should not stop taking it before surgery. Continue to take the medication as prescribed unless told otherwise by your surgeon."
microdiscectomy,Diet & Lifestyle,Do I need to stop eating or drinking before surgery?,Can I have water?; What is NPO?; Can I chew gum?,"Yes. Do not eat or drink anything after midnight the night before your surgery. This is called being ""NPO"". This includes water, coffee, and chewing gum. You may take approved morning medications with a small sip of water."
microdiscectomy,Day of Surgery,What should I wear to the hospital?,What kind of clothes should I bring?; What is best to wear after surgery?,"Please wear loose, comfortable clothing that is easy to put on and take off, such as sweatpants and a zip-up or button-up shirt. Avoid anything that you have to pull tightly over your head."
microdiscectomy,Post-Op Activity,How much should I walk after surgery?,When can I start walking?; How far should I walk?,"Walking is your most important recovery activity. We want you up and walking the same day as your surgery. Start with short, frequent walks inside your house and gradually increase the distance each day as you feel comfortable."
microdiscectomy,Post-Op Activity,What movements should I avoid after surgery?,What are the BLTs?; Can I bend over?; How much can I lift?,"For the first 4-6 weeks, you must strictly avoid the ""BLTs"": Bending at the waist, Lifting more than 10 pounds (about the weight of a gallon of milk), and Twisting your torso."
microdiscectomy,Post-Op Activity,When can I drive?,When can I operate a vehicle?; Is it okay to be a passenger in a car?,"You cannot drive until you are completely off all narcotic pain medication and feel you can react safely in an emergency. For most patients, this is around 2-3 weeks. It is safe to be a passenger in a car for short trips immediately after surgery."
microdiscectomy,Post-Op Activity,When can I return to work?,How long am I off work?; When can I go back to my desk job?,"This depends on your job. If you have a sedentary desk job, you may be able to return in 2-4 weeks. If you have a physically demanding job that requires heavy lifting or manual labor, you may need to be off work for 6-8 weeks or longer."
microdiscectomy,Incision Care,When can I shower after surgery?,Can I get my incision wet?; How long until I can shower?,"You may shower 48 hours after your surgery. Let the water run over the incision, but do not scrub it. Pat the area dry gently with a clean towel."
microdiscectomy,Incision Care,Can I take a bath or go swimming?,Is it okay to submerge the incision?; Can I use a hot tub?,"No. Do not take a bath or submerge the incision in any water (pool, lake, hot tub) for at least 4 weeks, or until your incision is completely healed and you are cleared by your surgeon."
microdiscectomy,Incision Care,What do I do about the dressing or surgical glue?,How do I care for the steri-strips?; When does the glue come off?,Your incision is covered with surgical glue (Dermabond) or steri-strips. Do not peel or pick at these. They will begin to peel off on their own in 10-14 days. You may trim any peeling edges if they are bothersome.
microdiscectomy,Pain & Meds,What kind of pain is normal after surgery?,Will I still have leg pain?; Why does my back hurt at the incision?,"It is normal to have localized pain at the incision site. You may also notice that your original leg pain (sciatica) is gone, but it can sometimes reappear intermittently as the nerve recovers and inflammation subsides. This is normal."
microdiscectomy,Pain & Meds,How should I use my prescribed pain medication?,How often should I take narcotics?; How do I manage my pain?,"The goal is to stay ahead of the pain for the first few days. Take your pain medication as prescribed. As you feel better, you can begin to increase the time between doses and then switch to Tylenol (Acetaminophen) as needed."
microdiscectomy,Pain & Meds,What should I do if I am constipated?,Is constipation normal after surgery?; How can I prevent constipation?,Constipation is a very common side effect of anesthesia and narcotic pain medication. We recommend starting an over-the-counter stool softener (like Colace) when you start taking narcotics. Drinking plenty of water and walking also helps.
microdiscectomy,Physical Therapy,Will I need physical therapy?,Do I need PT?; When does physical therapy start?,"Many patients do not require formal physical therapy. Walking is your main therapy for the first 6 weeks. If you still have weakness or mobility issues at your 6-week follow-up, we will discuss if physical therapy is the right next step for you."
microdiscectomy,Follow-Up,When is my first follow-up appointment?,When do I see the doctor again?; What happens at the first visit?,We will schedule your first follow-up visit for about two weeks after your surgery. This appointment is mainly to check on your incision and see how you are progressing. The next visit is typically around 6 weeks after surgery.
microdiscectomy,Warning Signs,What are the signs of an incision infection?,What if my incision is red?; Is drainage normal?,"Call our office if you notice increasing redness, swelling, warmth, or pus-like (thick, yellow, or green) drainage from your incision site. A small amount of clear or pinkish fluid can be normal in the first day or two."
microdiscectomy,Warning Signs,What symptoms require an urgent call to the doctor?,What are the red flags?; When should I be worried?,"Call our office immediately if you experience a fever over 101.5°F (38.6°C), new or worsening weakness in your legs or feet, or new problems with bowel or bladder control."
microdiscectomy,Warning Signs,What if I get a severe headache?,Why does my head hurt more when I sit up?,"If you develop a severe headache that is noticeably worse when you are sitting or standing up and gets better when you lie down, please call our office. This can be a sign of a spinal headache."
microdiscectomy,Warning Signs,What if I have new pain or swelling in my calf?,Why does my leg hurt?; Could this be a blood clot?,"If you develop new, persistent pain, swelling, or redness in one of your calves (not related to your incision), this could be a sign of a blood clot (DVT). Please call our office right away."
microdiscectomy,About the Procedure,Will this surgery fix my back pain?,"- Is this going to cure my lower backache? <br>- I thought this was for my leg, will my back feel better too? <br>- What's the main goal of this operation, back or leg pain?","The primary goal of this surgery is to relieve the leg pain, numbness, or weakness—the ""sciatica""—caused by the pinched nerve. While some patients do experience an improvement in their back pain, it is not the main purpose of the procedure, and we cannot guarantee your back pain will resolve."
microdiscectomy,About the Procedure,How big will my scar be?,- Will I have a large incision? <br>- What will the scar look like after a microdiscectomy? <br>- Is the cut very noticeable?,"The incision is very small, typically less than an inch long. We make it as discreetly as possible. Over time, it will fade and for most patients, it becomes a very fine line that is not very noticeable."
microdiscectomy,About the Procedure,What happens if I don't have the surgery?,- What are the risks of waiting? <br>- Can my condition get worse without the operation? <br>- Is surgery my only option?,"If the nerve remains pinched, your leg pain, numbness, or weakness could become more severe or even permanent. While other treatments like physical therapy and injections can help, if they haven't provided enough relief, surgery is the most effective way to prevent long-term nerve damage."
microdiscectomy,About the Procedure,Is this considered major surgery?,- How serious is a microdiscectomy? <br>- Would you classify this as a big operation? <br>- Am I undergoing a major procedure?,"While any surgery is a significant event, a microdiscectomy is considered a minimally invasive and very common procedure. It's not ""open"" back surgery. The small incision and muscle-sparing technique lead to a much faster recovery compared to traditional methods."
microdiscectomy,The Surgery,How long does the actual operation take?,- How many hours will I be in surgery? <br>- What is the duration of the procedure? <br>- How long will the surgeon be operating?,"The surgery itself is quite quick, usually taking about an hour from the first incision to the last stitch."
microdiscectomy,The Surgery,Will I have stitches that need to be removed?,- Do I have to come back to get stitches out? <br>- What kind of sutures do you use? <br>- Are the stitches dissolvable?,"We use sutures that are all underneath the skin and they will dissolve on their own, so you won't need to have any stitches removed at your follow-up appointment. We also use a special skin glue that will peel off over time."
microdiscectomy,The Surgery,Will I be able to feel anything during the surgery?,- What kind of anesthesia will I have? <br>- Will I be awake at all? <br>- Is it possible to wake up during the operation?,"No, you will be completely asleep under general anesthesia. You will not feel or remember anything about the procedure itself. Our anesthesia team will be monitoring you closely the entire time to ensure you are safe and comfortable."
microdiscectomy,Risks & Complications,What is the chance the disc will herniate again?,- Could this problem come back? <br>- How likely is a re-herniation? <br>- Can the disc slip again after surgery?,There is a 5 to 10 percent chance that the same disc could herniate again in the future. Following your post-operative restrictions and using good body mechanics for lifting can help reduce this risk.
microdiscectomy,Risks & Complications,What is a spinal fluid leak?,"- You mentioned a dural tear, what is that? <br>- Is a CSF leak dangerous? <br>- What happens if the sac around the nerves is torn?","The nerves in your spine are contained in a sac filled with spinal fluid. It's possible, though rare (about a 3% chance), for this sac to get nicked during surgery, causing a leak. It is not dangerous and is usually repaired right away during the procedure. It may require you to lie flat for a day or two after surgery to ensure it heals completely."
microdiscectomy,Risks & Complications,How will you protect my nerves during surgery?,- Is there a risk of nerve damage? <br>- What do you do to make sure the nerves are safe? <br>- Can the surgery make my leg pain worse?,"Nerve injury is the risk we take most seriously, but it is extremely rare, occurring in less than 1 in 1,000 surgeries. We use a microscope for a magnified view and very precise instruments. The goal is to gently free the nerve from pressure, and we handle it with the utmost care."
microdiscectomy,After Surgery,How soon will my leg pain be gone?,- Will I wake up without pain? <br>- When will the sciatica stop? <br>- Is the relief from leg pain immediate?,"Most patients notice an immediate and significant relief of their leg pain right after they wake up from surgery. It's important to remember that the nerve has been pinched and needs time to heal, so some residual numbness or tingling can take a few weeks to fully disappear."
microdiscectomy,After Surgery,Will I need a walker or a cane?,- Will I have trouble walking after surgery? <br>- Do I need any special equipment at home? <br>- Can I walk on my own right away?,The vast majority of patients are able to walk on their own without any assistance shortly after surgery. We will have you up and walking before you leave the hospital. A walker or cane is not typically needed.
microdiscectomy,After Surgery,How should I sleep?,- What is the best sleeping position after back surgery? <br>- Can I sleep on my stomach? <br>- Do I need a special pillow?,"The best positions are on your back with a pillow under your knees, or on your side with a pillow between your knees. This helps keep your spine in a neutral, comfortable position. We advise against sleeping on your stomach."
microdiscectomy,After Surgery,When can I go back to work?,- How much time do I need to take off? <br>- What is the recovery time before returning to my job? <br>- When am I cleared to work again?,"This depends on the type of work you do. If you have a desk job, you may be able to return in as little as one to two weeks. If your job is more physically demanding, you may need six weeks for moderate duty and up to three months for heavy labor."
microdiscectomy,After Surgery,When can I resume sexual activity?,- Is it safe to have sex after my surgery? <br>- How long should I wait to be intimate? <br>- Are there any restrictions on sexual relations?,You can typically resume sexual activity whenever you feel comfortable. Listen to your body and avoid positions that cause pain or strain your back. The safest position is generally lying flat on your back.
microdiscectomy,After Surgery,Will I need to wear a back brace?,- Do I get a brace after this surgery? <br>- Is a back support required? <br>- Will you be fitting me for a brace?,"No, a back brace is not typically needed after a standard microdiscectomy."
microdiscectomy,Pain Management,How much pain will I be in after the surgery?,- Is the recovery very painful? <br>- What is the post-op pain like? <br>- How bad does it hurt after the operation?,"You will have some ""incisional"" pain at the site of the surgery, which is different from the nerve pain you had before. This is normal and well-controlled with the pain medication we prescribe. Most patients find this surgical soreness manageable and it improves significantly over the first few days."
microdiscectomy,Pain Management,For how long will I need to take narcotic pain medicine?,- How long will I be on the strong pain pills? <br>- When can I switch to Tylenol? <br>- Do most people need narcotics for weeks?,"Most patients only need to take the narcotic pain medication for a few days, up to a week. We encourage you to switch to over-the-counter Tylenol as soon as your pain allows."
microdiscectomy,Pain Management,What are the side effects of the pain medication?,- Do the pain pills make you sick? <br>- What should I watch out for with narcotics? <br>- Are there common problems with the pain medicine?,"The most common side effects of narcotic pain medications are drowsiness, nausea, and constipation. It is very important to take a stool softener while you are taking them to avoid constipation. Do not drive or operate machinery while taking them."
microdiscectomy,Activity & Recovery,When can I shower?,- How long do I have to wait to wash? <br>- Is the incision waterproof? <br>- Can I get my back wet?,"You can shower two or three days after your surgery. You should let the water run over the incision but avoid scrubbing it. After, gently pat the area dry. You should not take a bath or go swimming for about six weeks."
microdiscectomy,Activity & Recovery,"What does ""no bending, lifting, or twisting"" really mean?",- Can you give me examples of what I can't do? <br>- How strict are the BLT restrictions? <br>- What movements should I avoid?,"It means you should not bend at the waist to pick things up, lift anything heavier than a gallon of milk (about 8-10 lbs), or twist your torso like you're swinging a golf club. When you need to pick something up, bend with your knees and keep your back straight."
microdiscectomy,Activity & Recovery,When can I start exercising again?,- When can I go back to the gym? <br>- What kind of exercise is safe to do? <br>- How soon can I work out?,"Walking is your most important exercise, and you should start right away. You can gradually increase your distance. We will likely prescribe physical therapy a few weeks after surgery to guide you in strengthening your core. More strenuous gym activities are usually not permitted until after the six-week mark."
microdiscectomy,Activity & Recovery,How much walking should I do?,- What's a good walking goal after surgery? <br>- Is it possible to walk too much? <br>- Can you give me a walking schedule?,"Start with short, frequent walks inside your home for the first week. By the third week, you should aim for about half a mile per day, and by the fourth week, up to a mile per day. It's best to break this up into several shorter walks. Listen to your body; if you feel sharp pain, it's time to rest."
microdiscectomy,Follow-Up,What happens at my first follow-up appointment?,- What should I expect at my two-week check-up? <br>- Why do I need to come back after two weeks? <br>- What is the purpose of the first post-op visit?,"The first appointment, usually two weeks after surgery, is primarily a wound check. We'll inspect your incision to make sure it's healing well. It's also a great opportunity for you to ask any questions that have come up since you've been home."
microdiscectomy,Follow-Up,"Will I need more imaging, like an MRI?",- Do I need another MRI after surgery? <br>- Will you take x-rays? <br>- How do you check if the surgery worked?,"We do not typically need to get another MRI after surgery unless new symptoms develop. We may take an x-ray at your follow-up appointments, but the best way to know the surgery was successful is the relief of your leg symptoms."
acdf,About the Procedure,What is an Anterior Cervical Discectomy and Fusion (ACDF)?,- Can you explain what an ACDF surgery is? <br>- What does ACDF stand for and what does it mean?,"An ACDF is a type of neck surgery performed to relieve pressure on your spinal cord or nerves. We go in through the front of your neck, which is the ""Anterior"" part. Then, we remove the damaged disc—that's the ""Discectomy."" Finally, we encourage the two vertebrae to grow together into one solid bone, which is the ""Fusion."" This process stabilizes your spine and prevents the painful pressure from coming back."
