SurgeryType,Category,Question,Alternate_Questions,Answer
microdiscectomy,Pre-Op Meds,What about my blood thinners like Aspirin or Plavix?,Do I need to stop my heart medication?; What about Xarelto or Eliquis?,"It is essential that you discuss stopping any blood thinner (Aspirin, Plavix, Xarelto, Eliquis, Coumadin) with the prescribing doctor (e.g., your cardiologist). We will provide specific instructions based on their recommendations, but our standard protocol requires stopping them 5-7 days before surgery."
microdiscectomy,Pre-Op Meds,Should I continue taking nerve medications like Neurontin or Lyrica?,What about gabapentin?; Do I stop pregabalin?,"These are nerve medications and help to calm down irritated or excited nerves. If you are currently on one of these medications, you should not stop taking it before surgery. Continue to take the medication as prescribed unless told otherwise by your surgeon."
microdiscectomy,Diet & Lifestyle,Do I need to stop eating or drinking before surgery?,Can I have water?; What is NPO?; Can I chew gum?,"Yes. Do not eat or drink anything after midnight the night before your surgery. This is called being ""NPO"". This includes water, coffee, and chewing gum. You may take approved morning medications with a small sip of water."
microdiscectomy,Day of Surgery,What should I wear to the hospital?,What kind of clothes should I bring?; What is best to wear after surgery?,"Please wear loose, comfortable clothing that is easy to put on and take off, such as sweatpants and a zip-up or button-up shirt. Avoid anything that you have to pull tightly over your head."
microdiscectomy,Post-Op Activity,How much should I walk after surgery?,When can I start walking?; How far should I walk?,"Walking is your most important recovery activity. We want you up and walking the same day as your surgery. Start with short, frequent walks inside your house and gradually increase the distance each day as you feel comfortable."
microdiscectomy,Post-Op Activity,What movements should I avoid after surgery?,What are the BLTs?; Can I bend over?; How much can I lift?,"For the first 4-6 weeks, you must strictly avoid the ""BLTs"": Bending at the waist, Lifting more than 10 pounds (about the weight of a gallon of milk), and Twisting your torso."
microdiscectomy,Post-Op Activity,When can I drive?,When can I operate a vehicle?; Is it okay to be a passenger in a car?,"You cannot drive until you are completely off all narcotic pain medication and feel you can react safely in an emergency. For most patients, this is around 2-3 weeks. It is safe to be a passenger in a car for short trips immediately after surgery."
microdiscectomy,Post-Op Activity,When can I return to work?,How long am I off work?; When can I go back to my desk job?,"This depends on your job. If you have a sedentary desk job, you may be able to return in 2-4 weeks. If you have a physically demanding job that requires heavy lifting or manual labor, you may need to be off work for 6-8 weeks or longer."
microdiscectomy,Incision Care,When can I shower after surgery?,Can I get my incision wet?; How long until I can shower?,"You may shower 48 hours after your surgery. Let the water run over the incision, but do not scrub it. Pat the area dry gently with a clean towel."
microdiscectomy,Incision Care,Can I take a bath or go swimming?,Is it okay to submerge the incision?; Can I use a hot tub?,"No. Do not take a bath or submerge the incision in any water (pool, lake, hot tub) for at least 4 weeks, or until your incision is completely healed and you are cleared by your surgeon."
microdiscectomy,Incision Care,What do I do about the dressing or surgical glue?,How do I care for the steri-strips?; When does the glue come off?,Your incision is covered with surgical glue (Dermabond) or steri-strips. Do not peel or pick at these. They will begin to peel off on their own in 10-14 days. You may trim any peeling edges if they are bothersome.
microdiscectomy,Pain & Meds,What kind of pain is normal after surgery?,Will I still have leg pain?; Why does my back hurt at the incision?,"It is normal to have localized pain at the incision site. You may also notice that your original leg pain (sciatica) is gone, but it can sometimes reappear intermittently as the nerve recovers and inflammation subsides. This is normal."
microdiscectomy,Pain & Meds,How should I use my prescribed pain medication?,How often should I take narcotics?; How do I manage my pain?,"The goal is to stay ahead of the pain for the first few days. Take your pain medication as prescribed. As you feel better, you can begin to increase the time between doses and then switch to Tylenol (Acetaminophen) as needed."
microdiscectomy,Pain & Meds,What should I do if I am constipated?,Is constipation normal after surgery?; How can I prevent constipation?,Constipation is a very common side effect of anesthesia and narcotic pain medication. We recommend starting an over-the-counter stool softener (like Colace) when you start taking narcotics. Drinking plenty of water and walking also helps.
microdiscectomy,Physical Therapy,Will I need physical therapy?,Do I need PT?; When does physical therapy start?,"Many patients do not require formal physical therapy. Walking is your main therapy for the first 6 weeks. If you still have weakness or mobility issues at your 6-week follow-up, we will discuss if physical therapy is the right next step for you."
microdiscectomy,Follow-Up,When is my first follow-up appointment?,When do I see the doctor again?; What happens at the first visit?,We will schedule your first follow-up visit for about two weeks after your surgery. This appointment is mainly to check on your incision and see how you are progressing. The next visit is typically around 6 weeks after surgery.
microdiscectomy,Warning Signs,What are the signs of an incision infection?,What if my incision is red?; Is drainage normal?,"Call our office if you notice increasing redness, swelling, warmth, or pus-like (thick, yellow, or green) drainage from your incision site. A small amount of clear or pinkish fluid can be normal in the first day or two."
microdiscectomy,Warning Signs,What symptoms require an urgent call to the doctor?,What are the red flags?; When should I be worried?,"Call our office immediately if you experience a fever over 101.5°F (38.6°C), new or worsening weakness in your legs or feet, or new problems with bowel or bladder control."
microdiscectomy,Warning Signs,What if I get a severe headache?,Why does my head hurt more when I sit up?,"If you develop a severe headache that is noticeably worse when you are sitting or standing up and gets better when you lie down, please call our office. This can be a sign of a spinal headache."
microdiscectomy,Warning Signs,What if I have new pain or swelling in my calf?,Why does my leg hurt?; Could this be a blood clot?,"If you develop new, persistent pain, swelling, or redness in one of your calves (not related to your incision), this could be a sign of a blood clot (DVT). Please call our office right away."
acdf,About the Procedure,What is an Anterior Cervical Discectomy and Fusion (ACDF)?,- Can you explain what an ACDF surgery is? <br>- What does ACDF stand for and what does it mean?; What is this?; What am I having done?,"An ACDF is a type of neck surgery performed to relieve pressure on your spinal cord or nerves. We go in through the front of your neck, which is the ""Anterior"" part. Then, we remove the damaged disc—that's the ""Discectomy."" Finally, we encourage the two vertebrae to grow together into one solid bone, which is the ""Fusion."" This process stabilizes your spine and prevents the painful pressure from coming back."
acdf,About the Procedure,Why do I need to have this surgery?,- What condition does this surgery treat? <br>- Why is an ACDF recommended for me?,"You are having this surgery because a disc or a bone spur in your neck is pressing on your spinal nerves or even the spinal cord itself. This pressure is what causes symptoms like pain in your neck or arms, numbness and tingling in your fingers, weakness, or even problems with coordination and balance. The goal of the surgery is to remove that pressure and give your nerves the space they need."
acdf,The Surgery,What happens during the operation?,- Can you walk me through the surgical process? <br>- What should I expect when I'm in the operating room?,"You will be comfortably asleep under general anesthesia. I will make a small incision in a natural crease on the front of your neck. I'll gently move the throat structures aside to access your spine. Using a microscope, I will remove the damaged disc and any bone spurs that are pinching the nerves. Then, I'll place a small spacer filled with bone graft material into the empty disc space. To hold everything securely while it heals, I'll attach a small titanium plate and screws. The incision is then closed with stitches that dissolve on their own."
acdf,The Surgery,Where does the bone for the fusion come from?,- Will you have to take bone from my hip? <br>- What is the bone graft made of?,"We use a combination of materials to help your bones fuse. This includes using some of your own bone that is collected during the procedure itself, as well as a sterilized bone product from a tissue bank. In the past, it was common to take bone from a patient's hip, but we rarely need to do that anymore, which avoids the pain that used to be associated with it."
acdf,Risks & Complications,What are the risks involved with this surgery?,- Is ACDF surgery dangerous? <br>- What are the potential complications I should know about?,"While ACDF is a very safe and common procedure, all surgeries have risks. The most common side effects are temporary and include a sore throat, hoarseness, and some difficulty swallowing for a few weeks. More serious complications are very rare but can include bleeding, infection, injury to the vocal cords, or the bones not fusing properly, which might require another surgery. We take every precaution to minimize these risks."
acdf,Preparation,How do I need to prepare for my surgery?,- What do I need to do before the operation? <br>- Is there a pre-op checklist I should follow?,"Before surgery, you'll get a medical clearance from your primary doctor. It's very important that you stop taking any anti-inflammatory medications like ibuprofen or Aleve, as well as any blood thinners, for one to two weeks before the procedure. If you smoke, you must stop, as it can prevent your bones from fusing. The night before, don't eat or drink anything after midnight. We'll give you a detailed list of instructions to follow."
acdf,Preparation,Why is it so important for me to stop smoking?,- Does smoking really affect the surgery outcome? <br>- What happens if I smoke before or after my fusion?,"Yes, it is absolutely critical. Nicotine severely restricts your blood vessels, which reduces the blood flow and oxygen that your bones need to heal and fuse together. Smoking cuts the chances of a successful fusion in half. For the best possible outcome, you need to stop smoking at least two weeks before surgery and stay smoke-free for at least three months afterward."
acdf,After Surgery,What can I expect right after I wake up from surgery?,- How will I feel immediately after the operation? <br>- Will I be in a lot of pain when I wake up?,"It's normal to have some neck and shoulder pain, as well as muscle spasms, which we will manage with medication. Many patients notice that the nerve pain in their arm is gone right away. You will likely have a sore throat and some difficulty swallowing, which is very common. Most patients stay in the hospital for one night for observation."
acdf,After Surgery,Will I have trouble swallowing?,- Is a sore throat normal after this surgery? <br>- What can I do if it's hard to swallow?,"Yes, difficulty swallowing is a very common and expected side effect. It happens because we have to gently move your esophagus and windpipe during surgery, which causes some temporary swelling. It's usually at its worst about 3 to 5 days after surgery. Eating soft foods and drinking cold things like ice water, ice cream, or smoothies can help a lot. This will get better over the next few weeks."
acdf,After Surgery,How do I take care of my incision?,- What are the instructions for wound care? <br>- When can I take the bandage off?,"Your incision will be covered with a waterproof dressing and skin glue. You can shower the day after surgery, but don't scrub the area. Just let water run over it and gently pat it dry. The dressing can usually be removed after 24 to 48 hours. Don't pick at the skin glue; it will dissolve and come off on its own. Do not put any creams or ointments on the incision."
acdf,After Surgery,Will I have to wear a neck brace?,- Do I need a cervical collar after surgery? <br>- For how long do I have to wear the brace?,"That depends on your specific surgery. If you had a fusion at multiple levels, you will likely wear a neck collar for about six to eight weeks to provide support while you heal. If you only had a single-level fusion, a collar is often not necessary. If you do need one, you can take it off for showering and eating, but you should wear it at all other times, especially when sleeping or riding in a car."
acdf,After Surgery,What are my activity restrictions after I go home?,- What am I allowed to do after surgery? <br>- How long until I can go back to my normal activities?,"For the first few weeks, you should avoid lifting anything heavier than about 10-15 pounds. There should be no repetitive bending or twisting of your neck. Walking is the best exercise you can do—start with short, frequent walks and gradually increase your distance. You should not drive while you are taking narcotic pain medication. Most people can return to full, unrestricted activities after about 8 to 12 weeks."
acdf,Medications,Are there any medications I should avoid after surgery?,- Can I take Advil or Aleve for pain? <br>- Which pain relievers are not allowed after a fusion?,"This is extremely important: you must avoid all non-steroidal anti-inflammatory drugs, or NSAIDs. This includes common over-the-counter medications like Ibuprofen (Advil, Motrin) and Naproxen (Aleve). These drugs can stop the bones from healing and fusing together. You should not take them for at least 3 months after surgery. We will give you a prescription for pain medication that is safe to use. Tylenol is also okay."
acdf,Follow-Up,When should I call the doctor's office?,- What are the warning signs I should look out for? <br>- What symptoms are considered an emergency?,"You should call us if you develop a fever over 101°F, if your incision becomes more red, swollen, or starts to drain, or if you experience worsening numbness or weakness in your arms or legs. If you have any trouble breathing or significant swelling in your neck, you should call 911 or go to the nearest emergency room immediately, as this is an emergency."
acdf,Foundational,What is an Anterior Cervical Discectomy and Fusion (ACDF)?,What does ACDF stand for?; Can you explain my neck surgery?,"An ACDF is a surgery performed through the front (""Anterior"") of your neck to relieve pressure on your spinal cord or nerves. We remove the damaged disc (""Discectomy"") and then encourage the two vertebrae to grow together into one solid bone (""Fusion""), which stabilizes the spine."
acdf,Foundational,Why do I need to have this surgery?,What condition does ACDF treat?; Why was this recommended for me?,"You are likely having this surgery because a disc or bone spur in your neck is compressing your spinal nerves or spinal cord. This pressure can cause neck/arm pain, numbness or tingling in your fingers (radiculopathy), or even issues with balance and coordination (myelopathy). The goal is to remove that pressure."
acdf,Pre-Op Prep,What medications do I need to stop before my ACDF?,Do I stop taking Advil?; What about blood thinners?,"This is critical for a fusion. You must stop all NSAIDs (Ibuprofen, Motrin, Advil, Naproxen, Aleve) at least 7 days before surgery. You must also get clearance from your prescribing doctor to stop any blood thinners. Tylenol is safe to continue."
acdf,Pre-Op Prep,Are there eating or drinking restrictions before surgery?,When do I need to be NPO?; Can I have water?,"Yes. Do not eat or drink anything after midnight the night before your surgery. This includes water, coffee, and chewing gum. You may take approved morning medications with a small sip of water."
acdf,The Cervical Collar,Will I have to wear a neck brace after surgery?,Do I get a collar?; What is the brace for?,"Yes, most patients will wake up in a cervical collar. This brace is not to help your neck heal, but rather to serve as a constant reminder to limit your neck motion and to protect the surgical site as the fusion begins."
acdf,The Cervical Collar,How long do I have to wear the collar?,When can I take the brace off?; Do I wear it 24/7?,"You should wear the collar at all times, including while sleeping, unless otherwise instructed. You may typically remove it for short periods to shower and clean the collar itself, starting 48 hours after surgery. Most patients wear the collar for 2 to 6 weeks."
acdf,Swallowing & Voice,Is it normal to have a sore throat or a hoarse voice?,Why is it hard to swallow?; Will my voice come back?,"Yes, this is very common and expected. The instruments used during surgery can irritate the nerves to your voice box and esophagus. Your throat will likely be sore, your voice may be hoarse, and you may feel a ""lump"" when you swallow. This almost always improves over several days to weeks."
acdf,Swallowing & Voice,What should I eat if it's hard to swallow?,What is the best diet after ACDF?; Are there foods to avoid?,"Start with a soft diet. Things like smoothies, yogurt, pudding, mashed potatoes, and soups are excellent choices. Avoid dry, crumbly, or tough foods like bread, crackers, and steak for the first few days, as they can be difficult to swallow."
acdf,Incision Care,How do I care for the incision on my neck?,When can I shower?; What do I do about the glue or steri-strips?,You may shower 48 hours after surgery. Let soapy water run over the incision but do not scrub it. Pat it dry gently. Your incision is sealed with surgical glue or steri-strips; do not peel them off. They will fall off on their own in 10-14 days.
acdf,Activity,How much can I lift after my ACDF?,What are my lifting restrictions?; Can I pick up my child?,"For the first 4-6 weeks, you should not lift anything heavier than a gallon of milk (about 8-10 pounds). This is to avoid straining your neck muscles and to protect the new fusion."
acdf,Activity,What other movements should I avoid?,Can I bend my neck?; Is it okay to twist my head?,You must avoid excessive or repetitive bending and twisting of your neck. Let the collar remind you. Avoid looking up at the ceiling or down at your shoes for long periods. Try to turn your whole body instead of just your neck.
acdf,Activity,When am I allowed to drive?,When is it safe to operate a car?,"You cannot drive as long as you are taking narcotic pain medication. You must also be able to turn your head comfortably enough to check blind spots and react in an emergency. For most, this is at least 2-4 weeks after surgery."
acdf,Sleeping,What is the best way to sleep after surgery?,How do I sleep with the collar on?; Can I sleep on my side?,Sleeping in a recliner or propped up in bed with several pillows is often most comfortable for the first week or two. It is safe to sleep on your back or your side. You must wear your collar while sleeping to prevent your neck from getting into an awkward position.
acdf,Medications,Which medications MUST I avoid after surgery?,Can I take Ibuprofen for pain?; Are NSAIDs okay after a fusion?,"This is extremely important: you must avoid all non-steroidal anti-inflammatory drugs (NSAIDs) for at least 3 months after surgery. This includes Advil, Motrin, Ibuprofen, Naproxen, and Aleve. These drugs can stop the bones from healing and fusing together."
acdf,Warning Signs,What symptoms require an urgent call to the office?,What are the red flags?; When should I be worried?,"Please call our office if you develop a fever over 101.5°F, if your incision becomes more red, swollen, or starts to drain pus, or if you experience new or worsening numbness, tingling, or weakness in your arms or legs."
acdf,Warning Signs,What symptoms are considered an emergency?,When should I call 911?; What if I can't breathe?,"If you experience significant, sudden swelling in your neck or have any difficulty breathing or catching your breath, this is an emergency. You should call 911 or go to the nearest emergency room immediately."
acdf,About the Hardware,What is the plate and screws you use made of?,Will I have metal in my neck?; What kind of hardware is it?,"We use a very small, low-profile plate and screws made of medical-grade titanium. This material is extremely strong, lightweight, and highly compatible with the body, meaning it very rarely causes any issues."
acdf,About the Hardware,Will the hardware set off metal detectors at the airport?,Do I need a doctor's note for TSA?; Will I have problems with security?,It's highly unlikely. Modern titanium hardware has a very low magnetic signature and is generally not detected by airport security scanners. You will not need a special card or note for travel.
acdf,About the Hardware,What do you use for the bone graft part of the fusion?,Where does the bone for the fusion come from?; Is it my own bone?,"For the fusion, we use a spacer that goes where the disc was, and this is filled with bone graft material to stimulate the vertebrae to grow together. We will discuss the specific type of graft material being used for your individual case before surgery."
acdf,Surgery & Hospital,How long does the ACDF operation usually take?,How long will I be in surgery?; What is the OR time?,"While every case is unique, a one or two-level ACDF surgery itself typically takes about 1 to 2 hours. You should plan on being in the operating room and recovery area for several hours total."
acdf,Surgery & Hospital,How long will I be in the hospital after surgery?,Is this an overnight stay?; When do I get to go home?,Most patients who have a one or two-level ACDF go home the same day or after a single overnight stay in the hospital. Our goal is to make sure your pain is controlled and you are able to walk safely before you are discharged.
acdf,Surgery & Hospital,Will I have a drain in my neck after surgery?,What is this tube coming out of my incision?; When does the drain come out?,"It is common to have a small, temporary surgical drain placed in the incision. This is done to prevent fluid from collecting under the skin. If you have one, it is typically removed before you leave the hospital."
acdf,Pain & Recovery,How much pain will I be in when I wake up?,Is this a very painful surgery?; What should I expect for pain control?,"You should expect to have some pain, particularly a sore throat and soreness at the incision site. We have a comprehensive pain management plan to keep you comfortable, using a combination of medications in the hospital and prescriptions for you to take at home. The severe arm pain you had before surgery is often gone immediately."
acdf,Pain & Recovery,Will I be prescribed muscle relaxers?,What can I do for neck spasms?; Are muscle spasms normal?,"Yes, neck muscle spasms are very common after this surgery as the muscles get used to the new alignment. We will typically provide a prescription for a muscle relaxer to help manage these spasms, especially for the first couple of weeks."
acdf,Recovery at Home,Will I need someone to help me at home?,Can I be alone after surgery?; What kind of help will I need?,"We strongly recommend having a friend or family member stay with you for at least the first 24-48 hours after you get home. They can help with meals, reminders for medication, and provide general support as you recover."
acdf,Recovery at Home,Is it safe for me to go up and down stairs?,Can I sleep in my upstairs bedroom?; Are stairs okay?,"Yes, you can use stairs. The key is to take them slowly and carefully. Always use the handrail for support and try to look straight ahead, rather than down at your feet, to avoid bending your neck."
acdf,Recovery at Home,What about my pets? Can I take care of my dog or cat?,Can I walk my dog?; Is it okay to bend over to feed my cat?,"You must be very careful with pets. You cannot bend your neck down to fill food or water bowls, so place them on a raised surface. You absolutely cannot walk a dog on a leash for the first 4-6 weeks, as a sudden pull could seriously injure your neck."
acdf,Long-Term Outlook,Will I lose a lot of motion in my neck forever?,How much will I be able to move my neck after it heals?; Will my neck feel stiff?,"This is a very common concern. For a one or two-level fusion, most patients notice very little, if any, change in their overall range of neck motion. The majority of your neck's rotation comes from the very top of your spine, which we are not operating on."
acdf,Long-Term Outlook,How long does it take for the fusion to be solid?,When is the bone fully healed?; What is the fusion success rate?,"A fusion is a slow process. While you will feel much better within weeks, it takes at least 3 to 6 months for the bone to become solid, and it can continue to mature for up to a year. We will track your healing with x-rays. The success rate for achieving a solid fusion is very high, typically well over 90%."
